{
  "meta": {
    "spec_id": "lighting_req_abandoned_temple",
    "poi_id": "[待对接]",
    "level_id": "abandoned_temple",
    "version": "0.1.0",
    "owner": "level"
  },
  "map_constraint": {
    "description": "整体环境光以冷蓝灰月色为基底，色温 4200-4800K，强度极低（废弃山寺无电力）。室内主要依赖玩家角色的手电、守护者手持灯笼（暖橙色，运动光源）、蜡烛/油灯的散点辅助。核心收束原则：光即危险——守护者靠近时亮度局部升高，玩家需在光圈外移动；谜题激活时冷光蓝白色短暂提示。"
  },
  "level_constraint": {
    "description": "关卡常亮指引光仅限三处：①山门入口石阶（弱蓝白月光勾边，引导入场方向）；②钟楼铜钟（Part 2 始终有一道漫反射月光打在钟体上，强化「可用」暗示）；③地下密室石碑（常亮冷光，即使黑暗中也可见，防止玩家迷失）。其余区域不设固定指引光——压迫感优先于引导清晰度。"
  },
  "mission_constraint": {
    "description": "任务流程灯光分三段：①潜入段（Part 1）：守护者灯笼轨迹即危险指示，无任务光强化，保持紧张压迫；②解谜触发时：机关激活伴随冷白闪光（0.3s 短时）+ 石碑蓝光微弱脉冲，强化反馈但不破坏氛围；③对峙段（Part 2）：铃铛敲响触发短暂全场月蓝色增亮（1.5s 缓入/缓出），守护者暴露弱点期间其身体有淡蓝色边缘光，标注攻击有效区域。"
  },
  "concept_art": {
    "ambient_only": {
      "status": "pending",
      "notes": "需体现月色冷蓝基底 + 守护者灯笼橙暖对比 + 极低整体亮度"
    },
    "with_mission": {
      "status": "pending",
      "notes": "需叠加机关激活白光脉冲 + 钟楼铃铛触发时全场蓝光增亮效果"
    }
  },
  "position_notes": "钟楼顶部月光开口是全场最亮单点（建议对比度拉到最大），与地下密室零月光形成场景内最大亮度跨度。",
  "ambience_refs": [
    {
      "region_id": "山门",
      "description": "几乎无光源区域——月色轮廓光勾勒石柱轮廓，地面反光依赖潮湿石板。守护者灯笼从远处透过山门可见，制造视觉纵深和危险预感。"
    },
    {
      "region_id": "前殿",
      "description": "守护者活动核心区，灯笼是主光源（暖橙 2800K，手持移动）。蜡烛数枚提供低频闪烁背景光，阴影方向持续变化。玩家进入时必须在光圈 3m 外移动。"
    },
    {
      "region_id": "回廊",
      "description": "廊道侧向敞开，月光以条状透过廊柱照入地面，形成间隔光影条纹。穿堂风导致少数烛台不稳定闪烁。整体亮度比前殿高但更「碎」，利于潜行。"
    },
    {
      "region_id": "主殿",
      "description": "体积感最强的灯光区域：顶部塌陷口透入月光形成垂直光柱打在残损佛龛上（冷蓝），守护者灯笼近身后形成橙蓝强对比。Part 1 阶段灯笼频率高，潜行难度最大。"
    },
    {
      "region_id": "地下密室",
      "description": "单一光源：符文石碑的冷蓝自发光（强度极低，恰好照亮 2m 半径内细节）。无其他光源，手电必要。石碑光脉冲：玩家靠近时频率从 0.5Hz 升至 2Hz，制造生理不适感。"
    },
    {
      "region_id": "钟楼",
      "description": "全场亮度最高点——月光从顶部开放框架直射铜钟，形成漫反射银白光晕覆盖整个楼层。玩家登楼后「如释重负」的视觉对比感在此实现。铃铛敲响时钟体振动产生金属高光闪烁（0.5s）。"
    },
    {
      "region_id": "藏经阁",
      "description": "单盏油灯（暖黄 2500K），守护者路过时携入灯笼短暂提升亮度后离开。书架形成大量竖向阴影分割，强化「藏」的感觉。失踪者背包区域背光，玩家需走近才能看清。"
    }
  ]
}
